{
  "schemaVersion": "1.0.0",
  "projectId": "prj_abc123456789",
  "panelPath": "trafego/PAINEL-DA-SEMANA.yaml",
  "sourceHashes": { "panel": "panelhash1234567890" },
  "readiness": "READY_FOR_ZELADOR",
  "insumos_a2": { "ticket": 997 },
  "projecao": { "roas_alvo": 3.5 },
  "studioSyncStatus": "pending"
}
